{"name":"mdx-auth-session-boundary","source":"docs/AUTH-SESSION.md","status":"deterministic-local-stub","local_route":"/local/auth-session.json","local_session":{"tenant_id":"local_tenant","user_id":"local_user","role":"owner","issued_at":"2026-01-01T00:00:00Z","expires_at":"2027-01-01T00:00:00Z"},"session_fields":["tenant_id","user_id","role","issued_at","expires_at"],"roles":["owner","operator","auditor","viewer"],"actor_admission":{"status":"LOCAL-ACTOR-ADMISSION-DECLARED","scope":"governed_write_commands","required_fields":["tenant_id","actor_id","actor_role","policy_decision_id","receipt_intent","source_route","request_id"],"accepted_local_fixture":{"tenant_id":"local_tenant","actor_id":"local_user","actor_role":"owner","policy_decision_id":"policy-local-actor-admission","receipt_intent":"governed_local_write","source_route":"/twin/session-drafts.json","request_id":"local-request-fixture"},"governed_routes":[{"route":"/twin/session-drafts.json","method":"POST","status":"LIVE-LOCAL-GOVERNED-WRITE"},{"route":"/twin/provider-call-refusals.json","method":"POST","status":"LIVE-LOCAL-GOVERNED-WRITE"},{"route":"/twin/production-memory-refusals.json","method":"POST","status":"LIVE-LOCAL-GOVERNED-WRITE"},{"route":"/twin/tool-execution-refusals.json","method":"POST","status":"LIVE-LOCAL-GOVERNED-WRITE"},{"route":"/forge/runs.json","method":"POST","status":"LIVE-LOCAL-GOVERNED-WRITE"},{"route":"/messages/thread-messages.json","method":"POST","status":"LIVE-LOCAL-GOVERNED-WRITE"},{"route":"/messages/fanout-requests.json","method":"POST","status":"LIVE-LOCAL-GOVERNED-WRITE"},{"route":"/messages/presence-requests.json","method":"POST","status":"LIVE-LOCAL-GOVERNED-WRITE"},{"route":"/messages/realtime-cutover-preflights.json","method":"POST","status":"LIVE-LOCAL-GOVERNED-WRITE"},{"route":"/messages/delivery-replay-batches.json","method":"POST","status":"LIVE-LOCAL-GOVERNED-WRITE"},{"route":"/messages/subscription-isolation-checks.json","method":"POST","status":"LIVE-LOCAL-GOVERNED-WRITE"},{"route":"/messages/service-role-fanout-refusals.json","method":"POST","status":"LIVE-LOCAL-GOVERNED-WRITE"},{"route":"/messages/relay-observations.json","method":"POST","status":"LIVE-LOCAL-GOVERNED-WRITE"},{"route":"/pages/publications.json","method":"POST","status":"LIVE-LOCAL-GOVERNED-WRITE"},{"route":"/pages/edit-drafts.json","method":"POST","status":"LIVE-LOCAL-GOVERNED-WRITE"},{"route":"/pages/approval-requests.json","method":"POST","status":"LIVE-LOCAL-GOVERNED-WRITE"},{"route":"/pages/approval-decisions/approve.json","method":"POST","status":"LIVE-LOCAL-GOVERNED-WRITE"},{"route":"/pages/approval-decisions/reject.json","method":"POST","status":"LIVE-LOCAL-GOVERNED-WRITE"},{"route":"/pages/search-preflights.json","method":"POST","status":"LIVE-LOCAL-GOVERNED-WRITE"},{"route":"/pages/revision-citation-comparisons.json","method":"POST","status":"LIVE-LOCAL-GOVERNED-WRITE"},{"route":"/pages/publication-visibility-checks.json","method":"POST","status":"LIVE-LOCAL-GOVERNED-WRITE"},{"route":"/pages/embedding-provider-refusals.json","method":"POST","status":"LIVE-LOCAL-GOVERNED-WRITE"},{"route":"/auth/tenant-policy-preflights.json","method":"POST","status":"LIVE-LOCAL-GOVERNED-WRITE"},{"route":"/auth/invite-requests.json","method":"POST","status":"LIVE-LOCAL-GOVERNED-WRITE"},{"route":"/auth/invite-redemptions.json","method":"POST","status":"LIVE-LOCAL-GOVERNED-WRITE"},{"route":"/auth/role-assignments.json","method":"POST","status":"LIVE-LOCAL-GOVERNED-WRITE"},{"route":"/auth/session-controls.json","method":"POST","status":"LIVE-LOCAL-GOVERNED-WRITE"},{"route":"/v1/read-shadow-approval-requests.json","method":"POST","status":"LIVE-LOCAL-GOVERNED-WRITE"},{"route":"/v1/read-shadow-approval-decisions.json","method":"POST","status":"LIVE-LOCAL-GOVERNED-WRITE"},{"route":"/v1/write-mirror-approval-requests.json","method":"POST","status":"LIVE-LOCAL-GOVERNED-WRITE"},{"route":"/v1/write-mirror-approval-decisions.json","method":"POST","status":"LIVE-LOCAL-GOVERNED-WRITE"}],"refusal_cases":["missing_tenant","missing_actor","missing_policy_decision","missing_receipt_intent","source_route_mismatch","service_role_bypass","user_metadata_authorization","role_escalation_without_policy","tenant_switch_without_policy"],"hidden_privilege_bypass_allowed":false,"production_write_allowed":false},"forbidden_until_live_gate":["password_login","oauth_login","session_write_cookie","tenant_switch_without_policy","role_escalation","service_role_bypass"],"required_controls":["tenant_required","user_required","role_required","expiry_required","policy_required_for_mutation","receipt_required_for_mutation","actor_admission_required_for_mutation","source_route_required_for_mutation","hidden_privilege_denial_required","session_lifecycle_receipts_required"],"rules":["local UI may use deterministic session fixtures only","local auth session route is read-only and deterministic","real login waits for an ADR, threat update, and local proof","no UI mutation exists without policy decision and Ledger receipt","governed writes require actor admission before receipts or local mutation","service-role shortcuts and hidden tenant switches are refused","session activation, revocation, tenant-switch refusal, and role-escalation refusal require receipts"]}